{
  "id": "cnb_feishu_ops_primary",
  "workspace_id": "wsp_mindverse_cn",
  "agent_id": "agt_ops_assistant_v1",
  "connector_id": "con_feishu_official",
  "scopes": [
    "message.send",
    "calendar.read",
    "doc.read"
  ],
  "auth_ref": "sec_feishu_tenant_token_prod",
  "risk_profile": "restricted",
  "status": "active",
  "created_at": "2026-02-22T12:00:00Z",
  "updated_at": "2026-02-22T12:00:00Z"
}
